[
  {
    "id": "sy-fixture-transport-route-status-2026-07-08-fixture-source",
    "name": {
      "en": "Fixture Transport Corridor"
    },
    "routeType": "corridor",
    "transportModes": ["road"],
    "observedStatus": "unknown",
    "statusAsOf": "2026-07-08",
    "origin": {
      "en": "Fixture Origin"
    },
    "destination": {
      "en": "Fixture Destination"
    },
    "transitCountries": [],
    "locationIds": ["sy-fixture-transport-location"],
    "sourceNames": ["Fixture Transport Location"],
    "indicativeLeadTime": "Fixture lead time",
    "routeNote": "Fixture high-level route observation without geometry.",
    "sourceIds": ["fixture-source"],
    "sourceReferences": [
      {
        "sourceId": "fixture-source",
        "sourceRecordId": "fixture-route-2026-07-08",
        "sourceRecordDate": "2026-07-08",
        "accessedAt": "2026-07-08T00:00:00.000Z"
      }
    ],
    "sourceStatus": "seed"
  }
]
